{
  "event": "messages",
  "id": "evt_link_only",
  "timestamp": "2026-09-26T14:03:40.000Z",
  "message": {
    "id": "spc-msg-00000000-0000-4000-8000-000000000102",
    "from": "+15555550100",
    "to": "+15555550999",
    "text": "http://localhost:8000/fixtures/listings/desk",
    "attachments": []
  }
}
