{
  "event": "messages",
  "id": "evt_image",
  "timestamp": "2026-09-26T14:05:02.000Z",
  "message": {
    "id": "spc-msg-00000000-0000-4000-8000-000000000103",
    "from": "+15555550100",
    "to": "+15555550999",
    "text": "Could this fit in my room?",
    "attachments": [{"url": "http://localhost:8000/fixtures/listings/desk.jpg", "mimeType": "image/jpeg"}]
  }
}
