{
  "event": "messages",
  "id": "evt_text_question",
  "timestamp": "2026-09-26T14:02:11.000Z",
  "message": {
    "id": "spc-msg-00000000-0000-4000-8000-000000000101",
    "from": "+15555550100",
    "to": "+15555550999",
    "text": "Will this fit beside my window without moving my bed? http://localhost:8000/fixtures/listings/desk",
    "attachments": []
  }
}
